digitalization,"is kommentelheti. a gazdasági növekedéshez, a hatékonyság javulásához, az export és az import megfelelő arányához. Kedvezőnek tartja a szövetség elnöke, hogy a kormány a kkv-knál is meg kívánja teremteni a szolgáltatói infrastruktúrához, a tudomány eredményeihez való hozzáférést, amellyel eddig csak a multinacionális vállalatok tudtak élni.A szövetség elnöke szerint a kkv-fejlesztési program megvalósulásához nagymértékben hozzájárulhat, hogy a kormány évente értékelni akarja az időarányos megvalósulást, részletezve a teljesülést és a lemaradást. Jó gondolat, hogy a kkv-programból adódó feladatok gondozására, figyelemmel kísérésére létrehoznának egy stratégiai tanácsadó testületet – tette hozzá. Vadász György kiemelte, a készülő kkv-fejlesztési programban benne van az érdekképviseletek által szorgalmazott működési feltételrendszer könnyítése, például a bérterhek enyhítésének folytatása, mert csak így tudják a kkv-szektorban a see the websitei bérfejlesztést megoldani, a foglalkoztatást erősíteni, a munkavállalókat Magyarországon tartani. A szövetség elnöke szerint segíti majd a kkv-k felzárkózását az adminisztráció see the websitei egyszerűsítése, például a szektor közbeszerzésen való részvételi lehetőségének könnyítése, a kisvállalkozói sajátosságokra jobban odafigyelő adórendszer kialakítása.Egyetértenek azzal, hogy a kormány érzékelhetően segíteni kívánja a kkv-k digitális felzárkóztatását, a következő uniós fejlesztési ciklus gazdaságfejlesztésében pedig meghatározó szerepet szán a kkv-szektornak, és ösztönzi a nemzedékváltást a vállalkozások see the websitevitele érdekében – mondta Vadász György. zt csak így tudjuk garantálni. Köszönjük!",https://adozona.hu/altalanos/Tetszik_az_OKISZelnoknek_a_kormany_keszulo__L1J0L7
digitalization,"délkelet-ázsiai országot kiszolgáló Grab bejelentette szerdán, hogy közel 1,5 milliárd dollárt kapott a SoftBank Vision Alapból. gba kerüljön a márka és a vállalat közlekedéssel kapcsolatos átfogó víziója, mivel a Bolt az autós utazásszervezésen túl, már motoros és e-rolleres utazásmegosztással is foglalkozik. tott sikert és kiugrási lehetőséget. Lássuk milyen példákat láttunk erre, amiket esetleg nem is gondoltatok eddig… eklődő diákoknak segít a pályaválasztásban. met tevékenysége középpontjába helyezte. A vállalat a „Biztonság vagy semmi” elnevezésű koncepcióval közelíti meg a kiberbiztonságot, központjai nyitva állnak az iparág által elismert kiberbiztonsági szabványoknak és gyakorlatnak megfelelő, igazságos, objektív és független biztonsági tesztek és ellenőrzések előtt. Ezeket a kiberbiztonsági központokat úgy alakították ki, hogy a vásárlók és független szervezetek számára biztosítsák a Huawei készülékeit, a szoftvereket, a technikai dokumentumokat, a teszteléshez szükséges eszközöket, valamint a megfelelő technikai támogatást. ma működéséig számos téma helyt kap az esemény menetrendjében. pozni, a tényeket bizonyítani kell, a bizonyítást pedig közös iparági szabványok alapján kell elvégezni. Hiszünk abban, hogy mindez a bizalom építésének hatékony modelljeként működhet a digitális világban”. A brüsszeli Kiberbiztonsági Átláthatósági Központ jobb lehetőségeket biztosít majd az együttműködésre, egyben bizonyítja a Huawei minden eddiginél erősebb kiberbiztonsági elkötelezettségét a kormányzatok, felhasználók és más európai partnerek felé.",https://startuponline.hu/15-milliard-dollar-tokebevonassal-hasit-az-uber-konkurense/
digitalization,"a megkérdezettek háromnegyede úgy gondolja, hogy a kiberbiztonság veszélyeivel szemben összehangolt és közös fellépésre lesz szükség, mivel egymagában egyetlen szervezet sem tudja megoldani a problémát.A kiberbiztonság miatti aggodalmak erősödésére utal, hogy a vezetők 56 százaléka szívesen fogadná, ha egy központi szervezet vagy irányító testület szigorúbb üzleti előírásokat határozna meg ezen a területen.„Az internetet nem ilyen szintű komplexitásra és digitális környezetre hozták létre, ezért elég egy óvatlan kattintás – a vállalaton belül vagy kívül – ahhoz, hogy valaki áldozatul essen egy végzetes kibertámadásnak” – emelte ki az Accenture Security ügyvezető igazgatója.",https://m2mzona.hu/biztonsag/globalis-megoldast-igenyelnek-a-kiberbiztonsagi-kockazatok
information,"valamint szabványokkal foglalkozó szervezetek közösen dolgozhatnak a digitális korszak biztonságán és fejlődésén. A vállalat a központban hozzáférhetővé és vizsgálhatóvá teszi forráskódjait és lehetőséget biztosít bit-szintű vizsgálatokra is.  s intelligencia vezérelt kamerarendszerrel rendelkezik. Az Y7 2019 segítséget nyújt a közösségi médiában aktív felhasználók számára is: a készülékkel részletgazdag, tűéles portréfotók és kiváló minőségű éjszakai felvételek is készítetők. A Huawei Y széria legújabb okostelefonja várhatóan idén márciusban érkezik a hazai boltok polcaira. apta a legtöbb elismerést, köztük a rangos nemzetközi szervezet, a GSMA legjobb összekapcsolt mobilkészülékének járó díjat is.  A MateBook széria legújabb tagjai is jól szerepeltek a technológiai kiállításon: a MateBook X Pro frissített verziója 12, a MateBook 14” pedig see the websitei 3 szakmai médium szerint volt az esemény legjobbja. dja a fotózás szerelmeseinek kezébe.  bshopjában is megvásárolhatnak. A szolgáltatónál a 6 GB + 128 GB tárhellyel rendelkező zafírkék verzió érhető el.  National Defense Authorization Act (NDAA) 889-es szakaszával szemben. Lépésével a vállalat egyrészt azt kívánja elérni, hogy olyan bírósági döntés szülessen, amely kimondja, hogy a vállalatot célzó korlátozások alkotmányellenesek, másrészt, hogy a szankciókkal szemben jogerős és hathatós végzéshez jusson.   változatos LED-termékeivel bármilyen tér lenyűgöző digitális környezetté alakítható át, a kijelzők által kínált üzleti szolgáltatások mindegyikét az ügyfelek igényeihez igazítva. ijelzőjével érkezik, amelyet kihajtva és összehajtva is, egy kompakt, teljes kijelzős készüléket eredményez. A Galaxy Fold új, erőteljes szintet hoz el a multitasking, a fotózás és videózás, valamint a játék terén. A készülék eddig nem tapasztalt lehetőségeket és élményeket teremt a következő generációk számára.  S10 készülékekkel ünnepli 10. születésnapját. A legújabb okostelefonok megkoronázzák az S széria múltját és utat mutatnak az iparág jövője felé. A csúcskategóriás készülékek előnyeit mostantól a magyar felhasználók is élvezhetik. nk képekre és gyors játékmenetre a következő generációs HDR-kész kijelző 1 ms válaszidejű TN panellel büszkélkedhet.   három tagja innovatív, újgenerációs kijelzővel, see the websitefejlesztett kamerafunkciókkal és kiemelkedő teljesítménnyel hozza el a jövő mobiltechnológiáját a felhasználók számára.",http://kutyu.hu/cikk/2019/03/13/a_stilus_es_a_sport_talalkozasa
information,"miközben hamarosan várhatóan egyre több iparágban egyre több munkakör fog megszűnni, a folyamatokat közelről látó vezetők inkább kerülik erről a nyilvános beszédet. Nem biztos, hogy pont 2019 lesz az az év, amikor a helyzetben rejlő feszültségek a felszínre törhetnek, de az is sejthető, hogy olyan sok idő nincs már hátra addig.Az idei fórum egy másik slágertémája egyértelműen Kína volt. Két évvel ezelőtt éppen Davosban állt ki Hszi Csin-ping kínai államfő, hogy közölje, Kína kész a globalizáció élére állni, oda, ahonnan Donald Trump megválasztása után az Egyesült Államok elkezdett kihátrálni. Az azóta eltelt időszakban Kína",https://444.hu/2019/01/28/a-vilag-elitje-osszeult-megallapitani-hogy-baj-van-majd-mindenki-szettarta-a-kezet
information,"az üzleti életben, a versenytársak körében, esetleg a politikai életben, a piacon, s nem utolsó sorban a vezetők és a beosztottak felett. Persze van hatalmuk a különböző beosztású vállalati vezetőknek is, de a tulajdonosokénál kisebb. A beosztott vezető ugyanis a cég vagy a részleg napi működéért, irányításáért felelős, a kockázatot viszont döntő mértékben a tulajdonos vállalja. legek között. A marketingesek szerint az ő tevékenységük nélkül nem lehetne növelni az eladásokat vagy éppen új piacokat találni. Az értékesítők pedig azon a véleményen vannak, hogy nincsen különösebb szükség a marketing részlegre, hiszen ők vannak „kint” a piacon, ők ismerik a lehetőségeket és az igényeket. Hasonló hatalmi ellentétek tapasztalhatók sok esetben a kutatási és fejlesztési részleg, valamint a pénzügyi tervezők között. szét igyekszik delegálni a középvezetőkhöz és a dolgozókhoz. Ez nem jelenti a felelősség megosztását, „lepasszolását”, hanem a hatalom közös gyakorlását bizonyos kérdésekben és területeken. A hatalom részbeni delegálása (empowerment) századunk első két évtizedének egyik új vezetési módszere, amely nagyobb hatékonyságot biztosít a vállalatoknak. ak hatalommal rendelkeznek azok, akik ezeket az információkat és adatokat elemzik, őket napjainkban spin doktoroknak hívják. hatalmát, személyi hatalmát nem a vállalati, hanem egyéni érdekei érvényesítésére használja fel. Konstruktív az az egyéni politikai magatartás, amely személytelen és a közösség, a vállalat érdekeit szolgálja. ra. Nem lehet fennakadás váratlan áramszünet esetén sem a céges informatika működésében, tehát az IT-részleg ilyenkor (is) stratégiai hatalmi helyzetben van. Az erőteljes központosítás, centralizáció is jelentős hatalmat biztosít azoknak, akik ezt a folyamatot irányítják, ellenőrzik. (Vannak persze ágazatok, munkahelyek – atomerőmű, fegyveres testületek, stb.- ahol a zavartalan működés megköveteli a központosítás különböző fokozatait, de ez az üzleti életre kevésbé jellemző.) ek nyomán függőség keletkezik, s az egyik részleg nagyobb hatalommal rendelkezik bizonyos területeken, mint a többiek. Úgy tartják, hogy az óra a vállalati életben is körbejár, vagyis kevés olyan csoport, részleg van, amely ne rendelkezne valamilyen csoportközi hatalommal.  segíti elő a nyílt és minden irányú kommunikáció és a befolyásolás alanyainak, célpontjainak tisztelete. A visszamérések azt mutatták, hogy a címzettek nagy része a napi levéltengerben nem olvasta el az értesítést, s így nem tudott a várható változásról.",http://azuzlet.hu/hatalom-es-politika-a-cegvilagban-aki-vesz-annak-lesz/
motivation,"diákoknak segít a pályaválasztásban. kerüljön a márka és a vállalat közlekedéssel kapcsolatos átfogó víziója, mivel a Bolt az autós utazásszervezésen túl, már motoros és e-rolleres utazásmegosztással is foglalkozik.  vagy tömegközlekedést használnak. see the websiteá ezzel a márkanévvel szeretnénk kifejezni abbéli hitünket és meggyőződésünket, hogy a közlekedés jövője az elektromos meghajtás.”  zó startup legújabb fejlesztése egy olyan élő, webalapú kvízjáték, amelyben a násznép okostelefonon keresztül vehet részt, a lagzi egy látványos, interaktív programelemeként. obogó-megosztást egyazon okostelefonos alkalmazáson belül. élkelet-ázsiai országot kiszolgáló Grab bejelentette szerdán, hogy közel 1,5 milliárd dollárt kapott a SoftBank Vision Alapból. latban a felhasználóknak nincs teendőjük, mivel az alkalmazás automatikusan frissül majd okostelefonjukon. ebb körű problémáira. taxirendelő alkalmazás volt, és a cégünk is erről kapta eredeti nevét. t vállalkozások arányát tekintve, miközben a Start it @K&H, hazánk vezető nagyvállalati inkubátora szerint ez az aktív részvétel a startupok esetében is megfigyelhető.  etek közösen dolgozhatnak a digitális korszak biztonságán és fejlődésén. tott sikert és kiugrási lehetőséget. Lássuk milyen példákat láttunk erre, amiket esetleg nem is gondoltatok eddig… zó startup legújabb fejlesztése egy olyan élő, webalapú kvízjáték, amelyben a násznép okostelefonon keresztül vehet részt, a lagzi egy látványos, interaktív programelemeként. ma működéséig számos téma helyt kap az esemény menetrendjében. ez kapcsolódó kérdésekre keresi a választ egy nemzetközileg is hasznosítható gyakorlatot fejlesztve.",https://startuponline.hu/a-taxify-neve-mostantol-bolt/
motivation,"jövőjével szemben, és addig, amíg a föld lakosainak ilyen nagy része see the websitera is kilátástalan szegénységben él, a természet ellen elkövetett bűnöknek nem lesz vége. nyoma (az éghajlatváltozásra gyakorolt hatása) nem nulla “zéró” akkor az a jelen állapot szerint biztos, hogy nem fenntartható! Mindeközben az ilyen meg olyan színes, gyönyörű és sok esetben több millió forintba kerülő fenntarthatósági jelentések gazdáit, különböző nemzetközi szervezetek kitüntetik. ni bűntettet hajtanak végre ellenük. nntartható jövőt addig a bizonyos pontig, amikor már semmi nem lesz visszafordítható! Ez pedig, ha így folytatódik még a jelen vezetőinek életében bekövetkezik.",https://piacesprofit.hu/klimablog/nyilt-level-a-vallalatvezetoknek/
motivation,"határozott szándéka, hogy minden magyar, aki dolgozni szeretne, munkához jusson. A gazdaság, technológia és munkaerőpiac változásai okozta kihívásoknak a szakképzés folyamatos korszerűsítésével felelhetünk meg. A diákoknak versenyképes végzettséget, a gazdaság által elvárt tudást kell kapniuk, ami biztos egzisztenciát és magas jövedelmet nyújt. A követendő irányok meghatározásában bevált nemzetközi - elsősorban osztrák és német - gyakorlatokra támaszkodhatunk - hangsúlyozta a miniszter. Ausztriában a 10. osztályosok több mint háromnegyede szakképzési úton, több mint egyharmaduk duális képzésben",http://www.kormany.hu/hu/innovacios-es-technologiai-miniszterium/hirek/osztrak-mintara-a-kamarak-es-vallalatok-kezdemenyezesere-fejleszti-a-kormany-a-szakkepzest
